{
  "$schema": "https://raw.githubusercontent.com/Naptie/openmetro/main/schemas/v1/transfers.schema.json",
  "schema_version": "1.0",
  "network_id": "cn-shijiazhuang",
  "generated_at": "2026-10-22T16:23:12.009Z",
  "source": [],
  "records": [
    {
      "id": "xfer-cn-shijiazhuang-beiguo-shangcheng-1-cn-shijiazhuang-beiguo-shangcheng-2",
      "station_id": "cn-shijiazhuang-beiguo-shangcheng",
      "from_line_id": "cn-shijiazhuang-line-1",
      "to_line_id": "cn-shijiazhuang-line-2",
      "from_stop_id": "cn-shijiazhuang-beiguo-shangcheng-1",
      "to_stop_id": "cn-shijiazhuang-beiguo-shangcheng-2",
      "walk_time_seconds": 193,
      "is_out_of_station": false,
      "source_id": "baidu-transit-station-hall-walk",
      "walk_distance_meters": 231,
      "extras": {
        "walk_distance_source": "baidu-transit-station-hall-walk"
      }
    },
    {
      "id": "xfer-cn-shijiazhuang-beiguo-shangcheng-2-cn-shijiazhuang-beiguo-shangcheng-1",
      "station_id": "cn-shijiazhuang-beiguo-shangcheng",
      "from_line_id": "cn-shijiazhuang-line-2",
      "to_line_id": "cn-shijiazhuang-line-1",
      "from_stop_id": "cn-shijiazhuang-beiguo-shangcheng-2",
      "to_stop_id": "cn-shijiazhuang-beiguo-shangcheng-1",
      "walk_time_seconds": 193,
      "is_out_of_station": false,
      "source_id": "baidu-transit-station-hall-walk",
      "walk_distance_meters": 231,
      "extras": {
        "walk_distance_source": "baidu-transit-station-hall-walk"
      }
    },
    {
      "id": "xfer-cn-shijiazhuang-shijiazhuang-zhan-2-cn-shijiazhuang-shijiazhuang-zhan-3",
      "station_id": "cn-shijiazhuang-shijiazhuang-zhan",
      "from_line_id": "cn-shijiazhuang-line-2",
      "to_line_id": "cn-shijiazhuang-line-3",
      "from_stop_id": "cn-shijiazhuang-shijiazhuang-zhan-2",
      "to_stop_id": "cn-shijiazhuang-shijiazhuang-zhan-3",
      "walk_time_seconds": 193,
      "is_out_of_station": false,
      "source_id": "baidu-transit-station-hall-walk",
      "walk_distance_meters": 231,
      "extras": {
        "walk_distance_source": "baidu-transit-station-hall-walk"
      }
    },
    {
      "id": "xfer-cn-shijiazhuang-shijiazhuang-zhan-3-cn-shijiazhuang-shijiazhuang-zhan-2",
      "station_id": "cn-shijiazhuang-shijiazhuang-zhan",
      "from_line_id": "cn-shijiazhuang-line-3",
      "to_line_id": "cn-shijiazhuang-line-2",
      "from_stop_id": "cn-shijiazhuang-shijiazhuang-zhan-3",
      "to_stop_id": "cn-shijiazhuang-shijiazhuang-zhan-2",
      "walk_time_seconds": 193,
      "is_out_of_station": false,
      "source_id": "baidu-transit-station-hall-walk",
      "walk_distance_meters": 231,
      "extras": {
        "walk_distance_source": "baidu-transit-station-hall-walk"
      }
    },
    {
      "id": "xfer-cn-shijiazhuang-xinbai-guangchang-1-cn-shijiazhuang-xinbai-guangchang-3",
      "station_id": "cn-shijiazhuang-xinbai-guangchang",
      "from_line_id": "cn-shijiazhuang-line-1",
      "to_line_id": "cn-shijiazhuang-line-3",
      "from_stop_id": "cn-shijiazhuang-xinbai-guangchang-1",
      "to_stop_id": "cn-shijiazhuang-xinbai-guangchang-3",
      "walk_time_seconds": 193,
      "is_out_of_station": false,
      "source_id": "baidu-transit-station-hall-walk",
      "walk_distance_meters": 231,
      "extras": {
        "walk_distance_source": "baidu-transit-station-hall-walk"
      }
    },
    {
      "id": "xfer-cn-shijiazhuang-xinbai-guangchang-3-cn-shijiazhuang-xinbai-guangchang-1",
      "station_id": "cn-shijiazhuang-xinbai-guangchang",
      "from_line_id": "cn-shijiazhuang-line-3",
      "to_line_id": "cn-shijiazhuang-line-1",
      "from_stop_id": "cn-shijiazhuang-xinbai-guangchang-3",
      "to_stop_id": "cn-shijiazhuang-xinbai-guangchang-1",
      "walk_time_seconds": 193,
      "is_out_of_station": false,
      "source_id": "baidu-transit-station-hall-walk",
      "walk_distance_meters": 231,
      "extras": {
        "walk_distance_source": "baidu-transit-station-hall-walk"
      }
    }
  ]
}
